{
  "$schema": "https://json-schema.org/draft/2020-12/schema",
  "title": "run — one retrieval execution",
  "description": "The provenance of coverage: when retrieval ran, with which config, over what window, what it matched, what it landed, and what it skipped as already known (OVERVIEW rule 1). Written by tools/fetch_pubmed.py, one per invocation; every article points back via run_id.",
  "x-kind": "run",
  "type": "object",
  "required": ["id", "date", "config", "window_start", "window_end", "matched", "added", "skipped_pmids"],
  "additionalProperties": false,
  "properties": {
    "id": { "type": "string", "pattern": "^R-[0-9]{3}$" },
    "date": { "type": "string", "pattern": "^[0-9]{4}-[0-9]{2}-[0-9]{2}$" },
    "config": {
      "type": "string",
      "pattern": "^C-[0-9]{2}$",
      "description": "The retrieval_config this run executed (referential integrity in validate.py)."
    },
    "window_start": { "type": "string", "pattern": "^[0-9]{4}-[0-9]{2}-[0-9]{2}$" },
    "window_end": { "type": "string", "pattern": "^[0-9]{4}-[0-9]{2}-[0-9]{2}$" },
    "matched": {
      "type": "number",
      "minimum": 0,
      "description": "Raw query matches in the window, before dedup."
    },
    "added": {
      "type": "array",
      "items": { "type": "string", "pattern": "^A-[0-9]{3}$" },
      "description": "The article records this run landed, in run order."
    },
    "skipped_pmids": {
      "type": "array",
      "items": { "type": "string", "pattern": "^[0-9]+$" },
      "description": "PMIDs already in the record — one record per PMID, ever."
    },
    "notes": { "type": "string" }
  }
}
